project_id,image_url,text,section_order,notes (internal only)
dashboard,images/placeholder-1.svg,"We started by interviewing stakeholders across four departments to understand how they use the existing dashboard and where they get stuck. The biggest pain point was the lack of customization — every team saw the same default view regardless of their role.",0,
dashboard,images/placeholder-2.svg,"Based on our research findings, we designed a role-based dashboard system that surfaces the most relevant metrics for each user type. Technical users see detailed system health data, while business stakeholders see high-level KPIs and trends.",1,
dashboard,images/placeholder-3.svg,"We validated the new designs through three rounds of usability testing. The final iteration reduced the average time to find key metrics from 45 seconds to under 10 seconds. The modular widget system also allowed teams to create custom views without engineering support.",2,
mobile-app,images/placeholder-2.svg,"Field workers told us their biggest frustration was losing work when connectivity dropped. We designed an offline-first architecture where all data entry happens locally and syncs automatically when a connection becomes available.",0,
mobile-app,images/placeholder-3.svg,"The task management interface was simplified to three core actions: start job, record data, and complete job. Each action was designed to work with gloved hands on a 5-inch screen in bright sunlight.",1,
mobile-app,images/placeholder-4.svg,"After launch, field completion rates increased by 34% and the average time per task decreased by 20%. Workers reported significantly less frustration with the new mobile experience compared to the previous desktop-only workflow.",2,
